{
  "schema_version": 2,
  "level_id": "REPLACE_level_id",
  "name": "REPLACE_关卡名",
  "archetype": "rush_standard",
  "meme_theme": "REPLACE_梗主题",
  "difficulty": "normal",
  "tile_size": 32,
  "width_tiles": 40,
  "height_tiles": 15,
  "player_spawn": { "x": 2, "y": 11 },
  "platforms": [
    { "x": 0, "y": 13, "w": 10, "h": 2 },
    { "x": 0, "y": 14, "w": 40, "h": 1 }
  ],
  "coins": [],
  "enemies": [],
  "goal": { "x": 36, "y": 11 },
  "win_rules": [{ "type": "reach_goal", "params": {} }],
  "tip_text": "REPLACE_提示文案"
}
